{
  "schema_version": 1,
  "kind": "production_corpus_baseline",
  "name": "production_e2_v1",
  "scorer_fingerprint": "ba934096e57b5466802d4f6902459de76ac8f13b3e843dfef47148f2761e82bd",
  "datasets": [
    {"name": "core_engineering_v1", "fingerprint": "789146b9d6ce360a42bef7ab4858ca1d3da4e238908c919c316065f6830f9b10"},
    {"name": "security_routing_v1", "fingerprint": "27a5c741195876411f80ba0e519d53dcf8f6623034cf402dcdaaa0b85897ff2d"},
    {"name": "context_retrieval_v1", "fingerprint": "06edb48e4189a1e529f986c1c9078f7d5d086b4e40a54f94c2964ba604a403be"},
    {"name": "repair_loops_v1", "fingerprint": "842121ed6cf4a71d2a8eee22c81264684102a01b20907df87063802c52f4b834"},
    {"name": "publication_safety_v1", "fingerprint": "6809afce25e152b4f091d0944ae9d96ad8672362d8e6be0b377a22c64d9dc50f"},
    {"name": "human_approval_v1", "fingerprint": "2d042dc903c2cbd9988bb96c8be9692417f254682f0b5b34194a14ce3a0651c8"}
  ],
  "case_ids": [
    "core-low-bug-fix-001",
    "core-medium-feature-002",
    "core-no-change-003",
    "core-idempotent-rerun-004",
    "core-runtime-failure-005",
    "security-critical-sensitive-value-001",
    "security-protected-path-002",
    "security-medium-finding-003",
    "security-unsafe-input-004",
    "security-clean-control-005",
    "context-policy-selection-001",
    "context-project-profile-002",
    "context-focused-repository-003",
    "context-private-memory-exclusion-004",
    "context-budget-boundary-005",
    "repair-quality-progress-001",
    "repair-review-progress-002",
    "repair-ci-existing-run-003",
    "repair-frontend-verification-004",
    "repair-exhaustion-005",
    "publication-low-success-001",
    "publication-medium-draft-002",
    "publication-high-denied-003",
    "publication-pr-failure-004",
    "publication-local-only-005",
    "approval-high-request-001",
    "approval-consume-resume-002",
    "approval-rejected-003",
    "approval-expired-004",
    "approval-low-control-005"
  ],
  "overall_score": 1.0,
  "coverage": 1.0,
  "metric_scores": {
    "risk_routing": 1.0,
    "artifact_completeness": 1.0,
    "security": 1.0,
    "publication_safety": 1.0,
    "context_selection": 1.0,
    "repair_progress": 1.0,
    "human_intervention": 1.0
  }
}
